{
  "adapter_version": "1.0",
  "schema_version": "0.1",
  "sources": [
    {
      "id": "basic",
      "revision": "1",
      "section": "basic",
      "origin": "declared",
      "data": {
        "skills": [
          {
            "id": "cooking",
            "label": "調理技能"
          },
          {
            "id": "service",
            "label": "接客技能"
          }
        ],
        "roles": [
          {
            "id": "kitchen",
            "label": "調理",
            "required_skills": [
              {
                "skill_id": "cooking",
                "min_level": 1
              }
            ]
          },
          {
            "id": "hall",
            "label": "ホール",
            "required_skills": [
              {
                "skill_id": "service",
                "min_level": 1
              }
            ]
          },
          {
            "id": "washing",
            "label": "皿洗い",
            "required_skills": []
          }
        ],
        "employees": [
          {
            "id": "alice",
            "label": "Aさん",
            "skills": [
              {
                "skill_id": "cooking",
                "level": 1
              }
            ]
          },
          {
            "id": "bob",
            "label": "Bさん",
            "skills": [
              {
                "skill_id": "service",
                "level": 1
              }
            ]
          },
          {
            "id": "carol",
            "label": "Cさん",
            "skills": []
          }
        ]
      },
      "references": [],
      "applies_to": null,
      "confirmation": {
        "digest": "6be535f093e9ba3fb9de9f66e4ca35e2544f55ad885c5a35837c7a031770df24",
        "provenance": "declared"
      }
    },
    {
      "id": "common",
      "revision": "1",
      "section": "common",
      "origin": "declared",
      "data": {
        "constraints": []
      },
      "references": [],
      "applies_to": null,
      "confirmation": {
        "digest": "b51ee4254cd90927ddeba5185e11e97dac8f5ca148cb86331fe224496e1e4aa6",
        "provenance": "declared"
      }
    },
    {
      "id": "period",
      "revision": "1",
      "section": "period",
      "origin": "declared",
      "data": {
        "request_id": "restaurant_assignment",
        "problem_type": "assignment",
        "planning_window": {
          "start": "2026-10-05T11:00:00+09:00",
          "end": "2026-10-05T13:00:00+09:00",
          "timezone": "Asia/Tokyo",
          "slot_minutes": 30
        },
        "employees": [
          {
            "id": "alice",
            "availability": [
              {
                "start": "2026-10-05T11:00:00+09:00",
                "end": "2026-10-05T13:00:00+09:00"
              }
            ]
          },
          {
            "id": "bob",
            "availability": [
              {
                "start": "2026-10-05T11:00:00+09:00",
                "end": "2026-10-05T13:00:00+09:00"
              }
            ]
          },
          {
            "id": "carol",
            "availability": [
              {
                "start": "2026-10-05T11:00:00+09:00",
                "end": "2026-10-05T13:00:00+09:00"
              }
            ]
          }
        ],
        "demand": [
          {
            "id": "kitchen_lunch",
            "role_id": "kitchen",
            "interval": {
              "start": "2026-10-05T11:00:00+09:00",
              "end": "2026-10-05T13:00:00+09:00"
            },
            "required_people": 1
          },
          {
            "id": "hall_lunch",
            "role_id": "hall",
            "interval": {
              "start": "2026-10-05T11:00:00+09:00",
              "end": "2026-10-05T13:00:00+09:00"
            },
            "required_people": 1
          },
          {
            "id": "washing_lunch",
            "role_id": "washing",
            "interval": {
              "start": "2026-10-05T11:00:00+09:00",
              "end": "2026-10-05T13:00:00+09:00"
            },
            "required_people": 1
          }
        ],
        "shift_candidates": [],
        "preferences": [
          {
            "id": "preserve_specialists",
            "type": "avoid_role",
            "employee_ids": [
              "alice",
              "bob"
            ],
            "role_id": "washing",
            "penalty_per_minute": 1
          }
        ]
      },
      "references": [],
      "applies_to": {
        "start": "2026-10-05T11:00:00+09:00",
        "end": "2026-10-05T13:00:00+09:00",
        "timezone": "Asia/Tokyo",
        "slot_minutes": 30
      },
      "confirmation": {
        "digest": "e90d93a6b8bd2455968b065c6d9b8275b95c7d561f3187f90a85262f679a24ed",
        "provenance": "declared"
      }
    },
    {
      "id": "execution",
      "revision": "1",
      "section": "execution",
      "origin": "declared",
      "data": {
        "objectives": [
          {
            "id": "use_skills",
            "metric": "preference_penalty"
          }
        ],
        "solver": {
          "backend": "auto",
          "time_limit_seconds": 10,
          "seed": 0
        }
      },
      "references": [],
      "applies_to": null,
      "confirmation": {
        "digest": "9259c8c3caa9ea941a7e354daa9b358007aaac92b80403d0331ff2a2c4035a0f",
        "provenance": "declared"
      }
    }
  ],
  "unresolved": [],
  "assumptions": [],
  "overrides": [],
  "order": {
    "constraints": []
  }
}
