{
  "adapter_version": "1.0",
  "schema_version": "0.6",
  "sources": [
    {
      "id": "basic",
      "revision": "1",
      "section": "basic",
      "origin": "declared",
      "data": {
        "skills": [],
        "roles": [
          {
            "id": "kitchen",
            "label": "調理",
            "required_skills": []
          }
        ],
        "employees": [
          {
            "id": "alice",
            "label": "Alice",
            "skills": []
          }
        ]
      },
      "references": [],
      "applies_to": null,
      "confirmation": {
        "digest": "31216aa89239366ba77e24244544cad7f9791acfacbc238405a6c49730357fdd",
        "provenance": "declared"
      }
    },
    {
      "id": "common",
      "revision": "1",
      "section": "common",
      "origin": "declared",
      "data": {
        "constraints": [
          {
            "id": "rest",
            "type": "min_rest_minutes",
            "employee_ids": [
              "alice"
            ],
            "limit_minutes": 660
          },
          {
            "id": "days",
            "type": "max_consecutive_days",
            "employee_ids": [
              "alice"
            ],
            "limit_days": 5
          }
        ]
      },
      "references": [],
      "applies_to": null,
      "confirmation": {
        "digest": "b540893fea7f9d37f4bd5722e765e984f77ba63309708dd5eab9d090e4333823",
        "provenance": "declared"
      }
    },
    {
      "id": "period",
      "revision": "1",
      "section": "period",
      "origin": "declared",
      "data": {
        "request_id": "continuity_demo",
        "problem_type": "roster",
        "planning_window": {
          "start": "2026-10-07T00:00:00+09:00",
          "end": "2026-10-12T00:00:00+09:00",
          "timezone": "Asia/Tokyo",
          "slot_minutes": 30
        },
        "employees": [
          {
            "id": "alice",
            "availability": [
              {
                "start": "2026-10-07T00:00:00+09:00",
                "end": "2026-10-12T00:00:00+09:00"
              }
            ]
          }
        ],
        "demand": [
          {
            "id": "need_10-07",
            "role_id": "kitchen",
            "interval": {
              "start": "2026-10-07T09:00:00+09:00",
              "end": "2026-10-07T17:00:00+09:00"
            },
            "required_people": 1
          },
          {
            "id": "need_10-08",
            "role_id": "kitchen",
            "interval": {
              "start": "2026-10-08T09:00:00+09:00",
              "end": "2026-10-08T17:00:00+09:00"
            },
            "required_people": 1
          },
          {
            "id": "need_10-09",
            "role_id": "kitchen",
            "interval": {
              "start": "2026-10-09T09:00:00+09:00",
              "end": "2026-10-09T17:00:00+09:00"
            },
            "required_people": 1
          },
          {
            "id": "need_10-10",
            "role_id": "kitchen",
            "interval": {
              "start": "2026-10-10T09:00:00+09:00",
              "end": "2026-10-10T17:00:00+09:00"
            },
            "required_people": 1
          }
        ],
        "shift_candidates": [
          {
            "employee_id": "alice",
            "id": "work_10-07",
            "segments": [
              {
                "interval": {
                  "start": "2026-10-07T09:00:00+09:00",
                  "end": "2026-10-07T17:00:00+09:00"
                },
                "breaks": []
              }
            ]
          },
          {
            "employee_id": "alice",
            "id": "work_10-08",
            "segments": [
              {
                "interval": {
                  "start": "2026-10-08T09:00:00+09:00",
                  "end": "2026-10-08T17:00:00+09:00"
                },
                "breaks": []
              }
            ]
          },
          {
            "employee_id": "alice",
            "id": "work_10-09",
            "segments": [
              {
                "interval": {
                  "start": "2026-10-09T09:00:00+09:00",
                  "end": "2026-10-09T17:00:00+09:00"
                },
                "breaks": []
              }
            ]
          },
          {
            "employee_id": "alice",
            "id": "work_10-10",
            "segments": [
              {
                "interval": {
                  "start": "2026-10-10T09:00:00+09:00",
                  "end": "2026-10-10T17:00:00+09:00"
                },
                "breaks": []
              }
            ]
          }
        ],
        "constraints": [
          {
            "id": "week",
            "type": "scheduled_minutes_bounds",
            "employee_ids": [
              "alice"
            ],
            "interval": {
              "start": "2026-10-05T00:00:00+09:00",
              "end": "2026-10-12T00:00:00+09:00"
            },
            "max_minutes": 2400
          }
        ],
        "preferences": []
      },
      "references": [],
      "applies_to": {
        "start": "2026-10-07T00:00:00+09:00",
        "end": "2026-10-12T00:00:00+09:00",
        "timezone": "Asia/Tokyo",
        "slot_minutes": 30
      },
      "confirmation": {
        "digest": "ff9eb537df74c2d884c59927409ab54b37f3a552e21908efa6ab2b13c27bb35b",
        "provenance": "declared"
      }
    },
    {
      "id": "history",
      "revision": "1",
      "section": "history",
      "origin": "declared",
      "data": {
        "continuity": {
          "context_window": {
            "start": "2026-10-05T00:00:00+09:00",
            "end": "2026-10-12T00:00:00+09:00"
          },
          "employees": [
            {
              "employee_id": "alice",
              "before_context": {
                "last_shift_end": null,
                "last_work_day": null,
                "consecutive_work_days_before_window": 0
              },
              "past_complete": true,
              "actual_shifts": [
                {
                  "id": "actual_10-05",
                  "segments": [
                    {
                      "interval": {
                        "start": "2026-10-05T09:00:00+09:00",
                        "end": "2026-10-05T17:00:00+09:00"
                      },
                      "breaks": []
                    }
                  ]
                },
                {
                  "id": "actual_10-06",
                  "segments": [
                    {
                      "interval": {
                        "start": "2026-10-06T09:00:00+09:00",
                        "end": "2026-10-06T17:00:00+09:00"
                      },
                      "breaks": []
                    }
                  ]
                }
              ],
              "commitments_complete": true,
              "committed_shifts": []
            }
          ]
        }
      },
      "references": [],
      "applies_to": {
        "start": "2026-10-05T00:00:00+09:00",
        "end": "2026-10-12T00:00:00+09:00"
      },
      "confirmation": {
        "digest": "ab4a4c3f4d084b35c5b5d1d4056d082bb6bb2b1debc8763c715af57afd09284a",
        "provenance": "declared"
      }
    },
    {
      "id": "execution",
      "revision": "1",
      "section": "execution",
      "origin": "declared",
      "data": {
        "objectives": [
          {
            "id": "work",
            "metric": "scheduled_minutes"
          }
        ],
        "solver": {
          "backend": "auto",
          "time_limit_seconds": 10,
          "seed": 0
        }
      },
      "references": [],
      "applies_to": null,
      "confirmation": {
        "digest": "337029c0dfc83448b00eb26212a354fb9ed15a2c3030c2f5b7513710e54814bd",
        "provenance": "declared"
      }
    }
  ],
  "unresolved": [],
  "assumptions": [],
  "overrides": [],
  "order": {
    "constraints": [
      "week",
      "rest",
      "days"
    ]
  }
}
