{
  "adapter_version": "1.0",
  "schema_version": "0.15",
  "sources": [
    {
      "id": "basic",
      "revision": "1",
      "section": "basic",
      "origin": "declared",
      "data": {
        "skills": [
          {
            "id": "cooking",
            "label": "調理技能"
          },
          {
            "id": "service",
            "label": "接客技能"
          }
        ],
        "roles": [
          {
            "id": "kitchen",
            "label": "調理",
            "required_skills": [
              {
                "skill_id": "cooking",
                "min_level": 1
              }
            ]
          },
          {
            "id": "hall",
            "label": "ホール",
            "required_skills": [
              {
                "skill_id": "service",
                "min_level": 1
              }
            ]
          },
          {
            "id": "washing",
            "label": "皿洗い",
            "required_skills": []
          }
        ],
        "employees": [
          {
            "id": "alice",
            "label": "Aさん",
            "skills": [
              {
                "skill_id": "cooking",
                "level": 1
              }
            ]
          },
          {
            "id": "bob",
            "label": "Bさん",
            "skills": [
              {
                "skill_id": "service",
                "level": 1
              }
            ]
          },
          {
            "id": "carol",
            "label": "Cさん",
            "skills": []
          }
        ]
      },
      "references": [],
      "applies_to": null,
      "confirmation": null
    },
    {
      "id": "common",
      "revision": "1",
      "section": "common",
      "origin": "declared",
      "data": {
        "constraints": []
      },
      "references": [],
      "applies_to": null,
      "confirmation": {
        "digest": "c9a3847d2aefbd126470ba8dbe9bcf37c656199262004d72f3e07f38575f09bb",
        "provenance": "declared"
      }
    },
    {
      "id": "period",
      "revision": "53964dc251fba71a1c97c37365afe07d14fd90d0ef5703d34cba133a48cd5deb",
      "section": "period",
      "origin": "declared",
      "data": {
        "request_id": "restaurant_assignment",
        "problem_type": "assignment",
        "planning_window": {
          "start": "2026-10-05T11:00:00+09:00",
          "end": "2026-10-05T13:00:00+09:00",
          "timezone": "Asia/Tokyo",
          "slot_minutes": 30
        },
        "employees": [
          {
            "id": "alice",
            "availability": [
              {
                "start": "2026-10-05T11:00:00+09:00",
                "end": "2026-10-05T13:00:00+09:00"
              }
            ]
          },
          {
            "id": "bob",
            "availability": [
              {
                "start": "2026-10-05T11:00:00+09:00",
                "end": "2026-10-05T13:00:00+09:00"
              }
            ]
          },
          {
            "id": "carol",
            "availability": [
              {
                "start": "2026-10-05T11:00:00+09:00",
                "end": "2026-10-05T13:00:00+09:00"
              }
            ]
          }
        ],
        "demand": [
          {
            "id": "kitchen_lunch",
            "role_id": "kitchen",
            "interval": {
              "start": "2026-10-05T11:00:00+09:00",
              "end": "2026-10-05T13:00:00+09:00"
            },
            "required_people": 1,
            "minimum_people": 1
          },
          {
            "id": "hall_lunch",
            "role_id": "hall",
            "interval": {
              "start": "2026-10-05T11:00:00+09:00",
              "end": "2026-10-05T13:00:00+09:00"
            },
            "required_people": 1,
            "minimum_people": 1
          },
          {
            "id": "washing_lunch",
            "role_id": "washing",
            "interval": {
              "start": "2026-10-05T11:00:00+09:00",
              "end": "2026-10-05T13:00:00+09:00"
            },
            "required_people": 1,
            "minimum_people": 1
          }
        ],
        "shift_candidates": [],
        "preferences": [
          {
            "id": "preserve_specialists",
            "type": "avoid_role",
            "employee_ids": [
              "alice",
              "bob"
            ],
            "role_id": "washing",
            "penalty_per_minute": 1
          }
        ]
      },
      "references": [],
      "applies_to": {
        "start": "2026-10-05T11:00:00+09:00",
        "end": "2026-10-05T13:00:00+09:00",
        "timezone": "Asia/Tokyo",
        "slot_minutes": 30
      },
      "confirmation": {
        "digest": "0af6740f47d39fd7415017405e6dbbd0e4eeb2310164b8ee55740c62e717ae1a",
        "provenance": "declared"
      }
    },
    {
      "id": "execution",
      "revision": "1",
      "section": "execution",
      "origin": "declared",
      "data": {
        "objectives": [
          {
            "id": "use_skills",
            "metric": "preference_penalty"
          }
        ],
        "solver": {
          "backend": "auto",
          "time_limit_seconds": 10,
          "seed": 0
        }
      },
      "references": [],
      "applies_to": null,
      "confirmation": {
        "digest": "45e21fd9a1af2a8ec88b4de45d72910968f61934d5262a6b2897bedd634e1977",
        "provenance": "declared"
      }
    }
  ],
  "unresolved": [
    {
      "source_id": "period",
      "json_pointer": "/employees/0/availability",
      "message": "勤務可能時間を担当者へ確認する"
    }
  ],
  "assumptions": [],
  "overrides": [],
  "order": {
    "constraints": []
  }
}
