{
  "adapter_version": "1.0",
  "schema_version": "0.3",
  "sources": [
    {
      "id": "basic",
      "revision": "1",
      "section": "basic",
      "origin": "declared",
      "data": {
        "skills": [],
        "roles": [
          {
            "id": "kitchen",
            "label": "kitchen",
            "required_skills": []
          },
          {
            "id": "hall",
            "label": "hall",
            "required_skills": []
          }
        ],
        "employees": [
          {
            "id": "alice",
            "label": "alice",
            "skills": []
          }
        ]
      },
      "references": [],
      "applies_to": null,
      "confirmation": {
        "digest": "2ed06085919e5c7973022e8f28ef4c69180830e2a4e9a8d3fcd132a494de4dd2",
        "provenance": "declared"
      }
    },
    {
      "id": "common",
      "revision": "1",
      "section": "common",
      "origin": "declared",
      "data": {
        "constraints": []
      },
      "references": [],
      "applies_to": null,
      "confirmation": {
        "digest": "b16647f4d5de5516468ac8428dd9aa2e5d50cab75c5dba42325eb1881b7914ed",
        "provenance": "declared"
      }
    },
    {
      "id": "period",
      "revision": "1",
      "section": "period",
      "origin": "declared",
      "data": {
        "request_id": "partial_roster",
        "problem_type": "roster",
        "planning_window": {
          "start": "2026-10-05T00:00:00+09:00",
          "end": "2026-10-06T00:00:00+09:00",
          "timezone": "Asia/Tokyo",
          "slot_minutes": 30
        },
        "employees": [
          {
            "id": "alice",
            "availability": [
              {
                "start": "2026-10-05T10:00:00+09:00",
                "end": "2026-10-05T11:30:00+09:00"
              }
            ]
          }
        ],
        "demand": [
          {
            "id": "need_0_600_kitchen",
            "role_id": "kitchen",
            "interval": {
              "start": "2026-10-05T10:00:00+09:00",
              "end": "2026-10-05T10:30:00+09:00"
            },
            "required_people": 2
          }
        ],
        "shift_candidates": [
          {
            "id": "shift_alice_0_600_690",
            "employee_id": "alice",
            "segments": [
              {
                "interval": {
                  "start": "2026-10-05T10:00:00+09:00",
                  "end": "2026-10-05T11:30:00+09:00"
                },
                "breaks": []
              }
            ]
          }
        ],
        "preferences": []
      },
      "references": [],
      "applies_to": {
        "start": "2026-10-05T00:00:00+09:00",
        "end": "2026-10-06T00:00:00+09:00",
        "timezone": "Asia/Tokyo",
        "slot_minutes": 30
      },
      "confirmation": {
        "digest": "98d9f0b38578d710f7d05502e28980a1c5ea58a7b9b8f87f3fbd21ed5b99f6a1",
        "provenance": "declared"
      }
    },
    {
      "id": "history",
      "revision": "1",
      "section": "history",
      "origin": "declared",
      "data": {
        "employees": [
          {
            "id": "alice",
            "history": {
              "last_shift_end": null,
              "consecutive_work_days_before_window": 0,
              "last_work_day": null
            }
          }
        ]
      },
      "references": [],
      "applies_to": {
        "start": "2026-10-05T00:00:00+09:00",
        "end": "2026-10-06T00:00:00+09:00",
        "timezone": "Asia/Tokyo",
        "slot_minutes": 30
      },
      "confirmation": {
        "digest": "6e58e5c3552ceffa94562e8aac6676b81921656e157314bcf4a82bfeb3e04741",
        "provenance": "declared"
      }
    },
    {
      "id": "execution",
      "revision": "1",
      "section": "execution",
      "origin": "declared",
      "data": {
        "objectives": [
          {
            "id": "work",
            "metric": "scheduled_minutes"
          }
        ],
        "solver": {
          "backend": "auto",
          "time_limit_seconds": 10,
          "seed": 0
        },
        "diagnosis": {
          "time_limit_seconds": 10,
          "max_suggestions": 2,
          "allowed_changes": [
            {
              "id": "one_person",
              "edits": [
                {
                  "json_pointer": "/demand/0/required_people",
                  "value": 1
                }
              ]
            },
            {
              "id": "unchanged",
              "edits": [
                {
                  "json_pointer": "/demand/0/required_people",
                  "value": 2
                }
              ]
            }
          ]
        }
      },
      "references": [],
      "applies_to": null,
      "confirmation": {
        "digest": "91be751a74a4fef0fe1f78c1a215ef2d25f2ca691bcefd6e486fda9900ae21f9",
        "provenance": "declared"
      }
    }
  ],
  "unresolved": [],
  "assumptions": [],
  "overrides": [],
  "order": {
    "constraints": []
  }
}
